"996641370102311","The Car of your dreams","Title from data sheet.;Intended audience: Ages 13 through adult.","U-matic.","v",,,,"[videorecording] /","\"
"996704400102311","Belorusskii︠ℓ︡vokzal","English title [tr. by cataloger]: Byelorussian [railway] station.;Issued also as a motion picture.",,"v",,,,"[videorecording] /","\"
"996500260102311","Macbeth /","Sponsored by Hallmark Cards; commercials by the sponsor inserted at the end of the program.;VHS format.",,"v",,,,"[videorecording]","\"
"996744220102311","Islands in the stream.","VHS format release of 1977 film.",,"v",,,,"[videorecording] /","\"
"996815190102311","Bizet's Carmen","In French with English subtitles.;The book of the opera by Meilhac and Halévy; based on a short story by Prosper Meŕimée.;VHS format.;""60487""",,"v",,,,"[videorecording] /","\"
"996474470102311","Musical holdouts.",,,"m",,,,"[motion picture] /","\"
"996611950102311","True glory","Videocassette copy. 2 cassettes.",,"m",,,,"[motion picture]","\"
"996832780102311","World War II propaganda films.","VHS format.;Originally released 1944-1945.;Title from notes ; title on container : Nostalgia World War II video library, #1.",,"v",,,,"[videorecording] / produced by the U.S. War Department.","\"
"996498300102311","That was rock","VHS format.;""M434"";Videocassette release of the 1964 and 1965 TAMI and TNT Shows by Electronovision Productions (1964), American International Productions (1965). Released in 1982 by UPA Productions of America.",,"v",,,,"[videorecording] :","\"
"996519810102311","Dolomitization","""A continuing education course presented at the 1982 AAPG Fall Education Conference.""-Container.",,"g",,,,"[slide] /","\"
"996619720102311","Where did you get that woman?","VHS format.",,"v",,,,"[videorecording] /","\"
"996601240102311","My mother, my father","Title from data sheet.;Intended audience: Adults.",,"m",,,,"[motion picture] /","\"
"996834110102311","Plucked instruments","VHS format.",,"v",,,,"[videorecording] /","\"
"996836290102311","Nonhuman primates","Includes bibliographical references.",,"g",,,,"[slide] :","\"
"996882960102311","CPR for citizens","Title from data sheet.;Intended audience: General.;Issued also in French, German, and Spanish.",,"m",,,,"[motion picture] :","\"
"996471180102311","Doctor Zhivago","VHS format.;MGM/UA Home Video: MV90003.;Vidorecording of the 1965 motion picture released by Metro-Goldwyn-Mayer.",,"v",,,,"[videorecording] /","\"
"996497820102311","Selected Techniques in canine thoracic surgery",,"U-matic.","v",,,,"[videorecording] /","\"
"996887370102311","The Great violin mystery","Title from data sheet.;Intended audience: General.;Issued as VHS 1/2 in.",,"v",,,,"[videorecording] /","\"
"996638140102311","States of mind","Recorded off-air with permission.",,"v",,,,"[videorecording] /","\"
"996769850102311","Rock'n soul live","VHS format.;""VH91065"";Videocassette release of the concert recorded live at the Montreal Forum, March 10-11, 1983, by M-1 Musical Enterprises, Inc.",,"v",,,,"[videorecording] /","\"
"996834130102311","The Drumset, a musical approach","Title on accompanying brochure : The Drum set.;Intended audience: Ages 12 through adult.","VHS.","v",,,,"[videorecording] /","\"
"996681910102311","Pride and prejudice","VHS format.;""M500114"";Based on Jane Austen's novel.;Videocassette release of the 1940 motion picture by Loew's Incorporated. Renewed in 1967 by Metro-Goldwyn-Mayer Inc.",,"v",,,,"[videorecording] /","\"
"997332460102311","David Oistrakh","Filmed in 1982.;Overdubbed in English.;Presented by Dennis M. Hedlund.",,"v",,,,"[videorecording] :","\"
"997029710102311","The Mikado","VHS.;Based on the comic opera by Gilbert and Sullivan.;""A Stratford Festival of Canada production."";Telecast in 1982.",,"v",,,,"[videorecording] /","\"
"997028340102311","La Cenerentola","""Thorn EMI/HBO classic performance."";VHS format.;""TVE 3559."";Opera in two acts.;At head of title: Glyndebourne Festival Opera.;Produced by BBC Television by arrangement with Glyndebourne in association with RM Arts.;Stereo., hi-fi, Dolby processed.;Synopsis and texts in English in booklet laid in container.",,"v",,,,"[videorecording] =","\"
"997127100102311","Academic convocation dedicating the College of Veterinary Medicine, University of Tennessee, September 22, 1979",,"U-matic.","v",,,,"[videorecording]","\"
"997294880102311","The History of life on earth.","In 3 carousels.",,"g",,,,"[slide].","\"
"997332510102311","Evolution and human equality",,,"v",,,,"[videorecording] /","\"
"997026010102311","Itzhak Perlman","VHS format.;Title on container: Beethoven violin concerto.;Videocassette release of the 1980 concert by EMI Records Ltd.",,"v",,,,"[videorecording] :","\"
"997055110102311","The Orthopedic examination",,"U-matic.","v",,,,"[videorecording] /","\"
"997017170102311","Poppea",,,"v",,,,"[videorecording] /","\"
"997017540102311","Creating the illusion",,,"v",,,,"[videorecording] :","\"
"997044990102311","Swan lake","Kultur VHS V1104.",,"v",,,,"[videorecording] :","\"
"997240170102311","The Changing high school","VHS format.;Accompanied by Program director-group leader manual and Participant's workbook, by Frederick P. Venditti.;University Archives copy is a motion picture.",,"v",,,,"[videorecording]:","\"
"997375960102311","Black jazz and blues","VHS format.;Title from container.;On label: 328.",,"v",,,,"[videorecording] :","\"
"997017630102311","Madama Butterfly","VHS format.;Sung in Italian ; subtitles in English.;Synopsis in English (7 p. ; 17 cm.) laid in container.",,"v",,,,"[videorecording] :","\"
"997016950102311","Black Americans: a historical portfolio.","Issued in 5 sections (30 slides each).;Designed for use with the silhouettes in courage education program containing 36 tape cassettes.;Revised version of the 1970 slide set entitled Black studies resources.;With guide.;Based on the William Loren Katz collection of rare prints and photographs.",,"g",,,,"[slide]","\"
"997162060102311","Antony & Cleopatra","VHS format.;""B003."";Title on container: The Tragedy of Antony and Cleopatra.",,"v",,,,"[videorecording] /","\"
"997053910102311","El Cid","Videocassette of the 1961 motion picture released by Samuel Bronston Productions.;VHS format.",,"v",,,,"[videorecording] /","\"
"997263480102311","Japanese literature on film","VHS format;""Janus film presentation.""",,"v",,,,"[videorecording] :","\"
"997018340102311","Nazi new order","Video cassette copy.",,"m",,,,"[motion picture]","\"
"997055560102311","Variations on a theme by Mozart","SAA documentary.",,"v",,,,"[videorecording] /","\"
"997010420102311","Don't cry, it's only thunder","VHS format.;""VH91250"";Based on the book by Paul G. Hensler.;Videocassette release of the 1981 motion picture by Sanrio Company, Ltd.",,"v",,,,"[videorecording] /","\"
"997209520102311","Pioneers of modern painting.","Mounted as 1381 slides in 12 carousels.",,"g",,,,"[slide] /","\"
"997187610102311","The Red badge of courage","Released as motion picture, 1951, by Loewe's Incorporated. Copyright renewed 1979 by Metro-Goldwyn-Mayer Inc.;VHS format.;""M300408""",,"v",,,,"[videorecording] /","\"
"997143660102311","Managing stress.",,,"m",,,,"[motion picture] /","\"
"996909000102311","The Other American minorities","Mounted as 225 slides in 2 carousels.;With teacher's guide.;Tape copy.",,"g",,,,"[filmstrip]","\"
"997026370102311","They shall take up serpents","U standard.",,"v",,,,"[videorecording].","\"
"997017270102311","The Gondoliers","VHS format.;Brian Macdonald's Stratford Festival production of the Gilbert & Sullivan opera for CBC Television.",,"v",,,,"[videorecording] /","\"
"997317480102311","The barber of Seville","Sung in Italian with English subtitles.","VHS.","v",,,,"[videorecording] :","\"
"997010950102311","Voices & visions","VHS format.",,"v",,,,"[videorecording] /","\"
"997012680102311","Les Troyens","VHS format.;""12509."";Opera in 3 acts.;In Italian with English subtitles.;Dates vary: on title frame, c1984; on container, c1986.;Stereo hi-fi, Dolby processed.;Program notes by David Hamilton and synopsis in English inserted in container.",,"v",,,,"[videorecording] /","\"
"997353830102311","Memories of hell","VHS format.;""#V430.""",,"v",,,,"[videorecording] /","\"
"997015720102311","Don Carlo","""#8339257/1-2"";Libretto by François Joseph Méry and Camille du Locle after Friedrich von Schiller's Don Carlos; Italian translation, Achille de Lauzières and Angelo Zanardini.;Recorded at the Royal Opera House, Covent Garden on April 17, 1985.;Sung in Italian, English subtitles.",,"v",,,,"[videorecording] /","\"
"997371380102311","Fellini satyricon","VHS format.;""M301385"";Italian with English subtitles.;Videocassette release of the 1969 motion picture.;Based on the Satyricon of Petronius Arbiter.",,"v",,,,"[videorecording] /","\"
"997240190102311","The Gods of the Ainu",,,"m",,,,"[motion picture] /","\"
"996915850102311","China and the world","Title from data sheet.;U standard.",,"v",,,,"[videorecording] /","\"
"997026460102311","The Versailles peace :","U standard.",,"v",,,,"[videorecording].","\"
"997383310102311","Word into image.","Title from data sheet.;Subtitle: Writers on screenwriting.;Originally shown on public television.;Intended audience: Adults.;Issued as VHS 1/2 in.",,"v",,,,"[videorecording] /","\"
"997017870102311","The love of three oranges","Sung in French with English subtitles.;Libretto by the composer after Carlo Gozzi.;VHS format.",,"v",,,,"[videorecording] /","\"
"997012550102311","The Atmosphere in motion","Cataloged from accompanying information.",,"m",,,,"[motion picture] /","\"
"996889870102311","Messiah","VHS format.;""TVE 2792"";An oratorio in 3 parts.;A performance of George Frideric Handel's oratorio, ""Messiah"".;Videocassette release of the 1982 production by the British Broadcasting Corp., in association with National Video Corp., Ltd.;Recorded in Westminster Abbey.;A libretto is included.",,"v",,,,"[videorecording] /","\"
